{
  "schema_version": "0.1",
  "id": "dbom-b2c3d4e5-6789-abcd-ef01-222222222222",
  "created_at": "2025-01-10T14:22:00Z",
  "source": {
    "uri": "gs://pharma-trials/experiment-batch-7/experiment_v2.csv",
    "hash": {
      "algorithm": "sha256",
      "value": "776ab79a9627a0c6032ace4f69431cba0e0831e00ca9c24e2b3d594ff1b5b9ae"
    },
    "format": "csv"
  },
  "signature": {
    "algorithm": "sha256",
    "value": "776ab79a9627a0c6032ace4f69431cba0e0831e00ca9c24e2b3d594ff1b5b9ae",
    "signer": "github:aronchick"
  },
  "lineage": [
    {
      "step": 1,
      "description": "Raw trial measurements exported from lab instrument HPLC-4200",
      "tool": "labware-export v3.0.1",
      "input_hash": "n/a",
      "output_hash": "a1b2c3d4e5f6a1b2c3d4e5f6a1b2c3d4e5f6a1b2c3d4e5f6a1b2c3d4e5f6a1b2"
    },
    {
      "step": 2,
      "description": "Outlier removal (>3σ) and unit normalization",
      "tool": "pandas-clean v1.2.0",
      "input_hash": "a1b2c3d4e5f6a1b2c3d4e5f6a1b2c3d4e5f6a1b2c3d4e5f6a1b2c3d4e5f6a1b2",
      "output_hash": "b2c3d4e5f6a1b2c3d4e5f6a1b2c3d4e5f6a1b2c3d4e5f6a1b2c3d4e5f6a1b2c3"
    },
    {
      "step": 3,
      "description": "Merged with compound metadata and formatted for analysis",
      "tool": "trial-prep v2.1.0",
      "input_hash": "b2c3d4e5f6a1b2c3d4e5f6a1b2c3d4e5f6a1b2c3d4e5f6a1b2c3d4e5f6a1b2c3",
      "output_hash": "776ab79a9627a0c6032ace4f69431cba0e0831e00ca9c24e2b3d594ff1b5b9ae"
    }
  ]
}
