{
  "schema_version": "0.1",
  "id": "dbom-d4e5f6a1-89ab-cdef-0123-444444444444",
  "created_at": "2025-01-20T16:45:00Z",
  "source": {
    "uri": "github:acme-corp/ml-pipeline/data/training_set.csv@main",
    "hash": {
      "algorithm": "sha256",
      "value": "e3b0c44298fc1c149afbf4c8996fb92427ae41e4649b934ca495991b7852b855"
    },
    "format": "csv"
  },
  "signature": {
    "algorithm": "sha256",
    "value": "e3b0c44298fc1c149afbf4c8996fb92427ae41e4649b934ca495991b7852b855",
    "signer": "github:aronchick"
  },
  "lineage": [
    {
      "step": 1,
      "description": "Auto-generated DBOM during CI build #1247",
      "tool": "makoto-action v0.1",
      "input_hash": "n/a",
      "output_hash": "e3b0c44298fc1c149afbf4c8996fb92427ae41e4649b934ca495991b7852b855"
    }
  ]
}
