{
  "schema_version": "0.1",
  "id": "dbom-c3d4e5f6-789a-bcde-f012-333333333333",
  "created_at": "2025-01-12T09:15:00Z",
  "source": {
    "uri": "https://data.org/datasets/imagenet-2024-val-sample.csv",
    "hash": {
      "algorithm": "sha256",
      "value": "1daa1d52d308d7834649042234d02d6e703df443485f5fb08af172d92ae0fe14"
    },
    "format": "csv"
  },
  "signature": {
    "algorithm": "sha256",
    "value": "1daa1d52d308d7834649042234d02d6e703df443485f5fb08af172d92ae0fe14",
    "signer": "github:aronchick"
  },
  "lineage": [
    {
      "step": 1,
      "description": "Original ImageNet validation labels from ILSVRC2012",
      "tool": "ilsvrc-export v1.0",
      "input_hash": "n/a",
      "output_hash": "f0e1d2c3b4a5f0e1d2c3b4a5f0e1d2c3b4a5f0e1d2c3b4a5f0e1d2c3b4a5f0e1"
    },
    {
      "step": 2,
      "description": "Sampled 10 representative images, added annotator metadata",
      "tool": "dataset-sampler v2.0",
      "input_hash": "f0e1d2c3b4a5f0e1d2c3b4a5f0e1d2c3b4a5f0e1d2c3b4a5f0e1d2c3b4a5f0e1",
      "output_hash": "1daa1d52d308d7834649042234d02d6e703df443485f5fb08af172d92ae0fe14"
    }
  ]
}
